[
  {
    "id": "state.pending",
    "kind": "state",
    "source": {
      "path": "frontend/src/pages/TitleDetail.tsx",
      "anchor": "disabled={busy"
    },
    "behavior": "Users receive the current pending state treatment when its source condition applies.",
    "dimensions": {
      "permissions": [
        "authenticated"
      ],
      "scopes": [
        "personal",
        "household"
      ],
      "themes": [
        "dark",
        "light",
        "system"
      ],
      "locales": [
        "de",
        "en",
        "es",
        "fr",
        "it",
        "nl"
      ],
      "states": [
        "pending"
      ]
    },
    "owner": {
      "requirement": "DSYS-03",
      "phase": 3
    },
    "evidence": [
      "planned:phase-3"
    ]
  },
  {
    "id": "state.success",
    "kind": "state",
    "source": {
      "path": "frontend/src/lib/app.tsx",
      "anchor": "const toast = useCallback"
    },
    "behavior": "Users receive the current success state treatment when its source condition applies.",
    "dimensions": {
      "permissions": [
        "authenticated"
      ],
      "scopes": [
        "personal",
        "household"
      ],
      "themes": [
        "dark",
        "light",
        "system"
      ],
      "locales": [
        "de",
        "en",
        "es",
        "fr",
        "it",
        "nl"
      ],
      "states": [
        "success"
      ]
    },
    "owner": {
      "requirement": "DSYS-03",
      "phase": 3
    },
    "evidence": [
      "planned:phase-3"
    ]
  },
  {
    "id": "theme.dark",
    "kind": "theme",
    "source": {
      "path": "frontend/src/lib/app.tsx",
      "anchor": "\"dark\""
    },
    "behavior": "Users can render the interface in dark theme mode.",
    "dimensions": {
      "permissions": [
        "authenticated"
      ],
      "scopes": [
        "personal",
        "household"
      ],
      "themes": [
        "dark",
        "light",
        "system"
      ],
      "locales": [
        "de",
        "en",
        "es",
        "fr",
        "it",
        "nl"
      ],
      "states": [
        "default"
      ]
    },
    "owner": {
      "requirement": "DSYS-05",
      "phase": 3
    },
    "evidence": [
      "frontend/src/pages/Settings.test.tsx"
    ]
  },
  {
    "id": "theme.light",
    "kind": "theme",
    "source": {
      "path": "frontend/src/lib/app.tsx",
      "anchor": "\"light\""
    },
    "behavior": "Users can render the interface in light theme mode.",
    "dimensions": {
      "permissions": [
        "authenticated"
      ],
      "scopes": [
        "personal",
        "household"
      ],
      "themes": [
        "dark",
        "light",
        "system"
      ],
      "locales": [
        "de",
        "en",
        "es",
        "fr",
        "it",
        "nl"
      ],
      "states": [
        "default"
      ]
    },
    "owner": {
      "requirement": "DSYS-05",
      "phase": 3
    },
    "evidence": [
      "frontend/src/pages/Settings.test.tsx"
    ]
  },
  {
    "id": "theme.system",
    "kind": "theme",
    "source": {
      "path": "frontend/src/lib/app.tsx",
      "anchor": "\"system\""
    },
    "behavior": "Users can render the interface in system theme mode.",
    "dimensions": {
      "permissions": [
        "authenticated"
      ],
      "scopes": [
        "personal",
        "household"
      ],
      "themes": [
        "dark",
        "light",
        "system"
      ],
      "locales": [
        "de",
        "en",
        "es",
        "fr",
        "it",
        "nl"
      ],
      "states": [
        "default"
      ]
    },
    "owner": {
      "requirement": "DSYS-05",
      "phase": 3
    },
    "evidence": [
      "frontend/src/pages/Settings.test.tsx"
    ]
  },
  {
    "id": "route.wildcard",
    "kind": "route",
    "source": {
      "path": "frontend/src/App.tsx",
      "anchor": "path=\"*\""
    },
    "behavior": "Unknown authenticated paths fall back to the dashboard.",
    "dimensions": {
      "permissions": [
        "authenticated"
      ],
      "scopes": [
        "personal",
        "household"
      ],
      "themes": [
        "dark",
        "light",
        "system"
      ],
      "locales": [
        "de",
        "en",
        "es",
        "fr",
        "it",
        "nl"
      ],
      "states": [
        "default"
      ]
    },
    "owner": {
      "requirement": "SHEL-02",
      "phase": 4
    },
    "evidence": [
      "frontend/src/App.test.tsx"
    ]
  },
  {
    "id": "scope.household",
    "kind": "scope",
    "source": {
      "path": "frontend/src/lib/app.tsx",
      "anchor": "scope: string; // 'all' or a user id"
    },
    "behavior": "Users can view aggregate household data with the all scope.",
    "dimensions": {
      "permissions": [
        "authenticated"
      ],
      "scopes": [
        "personal",
        "household"
      ],
      "themes": [
        "dark",
        "light",
        "system"
      ],
      "locales": [
        "de",
        "en",
        "es",
        "fr",
        "it",
        "nl"
      ],
      "states": [
        "default"
      ]
    },
    "owner": {
      "requirement": "SHEL-03",
      "phase": 4
    },
    "evidence": [
      "planned:phase-4"
    ]
  },
  {
    "id": "scope.personal",
    "kind": "scope",
    "source": {
      "path": "frontend/src/lib/app.tsx",
      "anchor": "scope: string; // 'all' or a user id"
    },
    "behavior": "Users can select an individual profile scope by user identifier.",
    "dimensions": {
      "permissions": [
        "authenticated"
      ],
      "scopes": [
        "personal",
        "household"
      ],
      "themes": [
        "dark",
        "light",
        "system"
      ],
      "locales": [
        "de",
        "en",
        "es",
        "fr",
        "it",
        "nl"
      ],
      "states": [
        "default"
      ]
    },
    "owner": {
      "requirement": "SHEL-03",
      "phase": 4
    },
    "evidence": [
      "planned:phase-4"
    ]
  },
  {
    "id": "action.del.auth-passkeys-param",
    "kind": "action",
    "source": {
      "path": "frontend/src/lib/auth.ts",
      "anchor": "`/auth/passkeys/${id}`"
    },
    "behavior": "Authorized users can invoke the existing DEL /auth/passkeys/:param operation and receive its current reconciliation or feedback behavior.",
    "dimensions": {
      "permissions": [
        "public"
      ],
      "scopes": [
        "personal",
        "household"
      ],
      "themes": [
        "dark",
        "light",
        "system"
      ],
      "locales": [
        "de",
        "en",
        "es",
        "fr",
        "it",
        "nl"
      ],
      "states": [
        "pending",
        "success",
        "error"
      ]
    },
    "owner": {
      "requirement": "SHEL-04",
      "phase": 4
    },
    "evidence": [
      "planned:phase-4"
    ]
  },
  {
    "id": "action.post.auth-login-begin",
    "kind": "action",
    "source": {
      "path": "frontend/src/lib/auth.ts",
      "anchor": "\"/auth/login/begin\""
    },
    "behavior": "Authorized users can invoke the existing POST /auth/login/begin operation and receive its current reconciliation or feedback behavior.",
    "dimensions": {
      "permissions": [
        "public"
      ],
      "scopes": [
        "personal",
        "household"
      ],
      "themes": [
        "dark",
        "light",
        "system"
      ],
      "locales": [
        "de",
        "en",
        "es",
        "fr",
        "it",
        "nl"
      ],
      "states": [
        "pending",
        "success",
        "error"
      ]
    },
    "owner": {
      "requirement": "SHEL-04",
      "phase": 4
    },
    "evidence": [
      "planned:phase-4"
    ]
  },
  {
    "id": "action.post.auth-login-complete",
    "kind": "action",
    "source": {
      "path": "frontend/src/lib/auth.ts",
      "anchor": "\"/auth/login/complete\""
    },
    "behavior": "Authorized users can invoke the existing POST /auth/login/complete operation and receive its current reconciliation or feedback behavior.",
    "dimensions": {
      "permissions": [
        "public"
      ],
      "scopes": [
        "personal",
        "household"
      ],
      "themes": [
        "dark",
        "light",
        "system"
      ],
      "locales": [
        "de",
        "en",
        "es",
        "fr",
        "it",
        "nl"
      ],
      "states": [
        "pending",
        "success",
        "error"
      ]
    },
    "owner": {
      "requirement": "SHEL-04",
      "phase": 4
    },
    "evidence": [
      "planned:phase-4"
    ]
  },
  {
    "id": "action.post.auth-logout",
    "kind": "action",
    "source": {
      "path": "frontend/src/lib/app.tsx",
      "anchor": "\"/auth/logout\""
    },
    "behavior": "Authorized users can invoke the existing POST /auth/logout operation and receive its current reconciliation or feedback behavior.",
    "dimensions": {
      "permissions": [
        "public"
      ],
      "scopes": [
        "personal",
        "household"
      ],
      "themes": [
        "dark",
        "light",
        "system"
      ],
      "locales": [
        "de",
        "en",
        "es",
        "fr",
        "it",
        "nl"
      ],
      "states": [
        "pending",
        "success",
        "error"
      ]
    },
    "owner": {
      "requirement": "SHEL-04",
      "phase": 4
    },
    "evidence": [
      "planned:phase-4"
    ]
  },
  {
    "id": "action.post.auth-passkey-add-begin",
    "kind": "action",
    "source": {
      "path": "frontend/src/lib/auth.ts",
      "anchor": "\"/auth/passkey/add/begin\""
    },
    "behavior": "Authorized users can invoke the existing POST /auth/passkey/add/begin operation and receive its current reconciliation or feedback behavior.",
    "dimensions": {
      "permissions": [
        "public"
      ],
      "scopes": [
        "personal",
        "household"
      ],
      "themes": [
        "dark",